<?xml version="1.0" encoding="utf-8"?>
<!-- Created with Liquid XML Studio 1.0.7.0 (http://www.liquid-technologies.com) -->
<calendar xmlns:xsi="http://www.w3.org/2001/XMLSchema-instance" xsi:noNamespaceSchemaLocation="file:///C:/Documents%20and%20Settings/Prateek%20Tandon/Desktop/troyspace/xml_schemas/calendar_schema.xsd">
  <year>
    <month>
      <day>
        <event>
          <name>string</name>
          <start_time>
            <hour>string</hour>
            <minute>string</minute>
          </start_time>
          <end_time>
            <hour>string</hour>
            <minute>string</minute>
          </end_time>
          <location>string</location>
          <description>string</description>
        </event>
        <event>
          <name>string</name>
          <start_time>
            <hour>string</hour>
            <minute>string</minute>
          </start_time>
          <end_time>
            <hour>string</hour>
            <minute>string</minute>
          </end_time>
          <location>string</location>
          <description>string</description>
        </event>
        <event>
          <name>string</name>
          <start_time>
            <hour>string</hour>
            <minute>string</minute>
          </start_time>
          <end_time>
            <hour>string</hour>
            <minute>string</minute>
          </end_time>
          <location>string</location>
          <description>string</description>
        </event>
        <event>
          <name>string</name>
          <start_time>
            <hour>string</hour>
            <minute>string</minute>
          </start_time>
          <end_time>
            <hour>string</hour>
            <minute>string</minute>
          </end_time>
          <location>string</location>
          <description>string</description>
        </event>
        <event>
          <name>string</name>
          <start_time>
            <hour>string</hour>
            <minute>string</minute>
          </start_time>
          <end_time>
            <hour>string</hour>
            <minute>string</minute>
          </end_time>
          <location>string</location>
          <description>string</description>
        </event>
        <day_name>string</day_name>
      </day>
      <month_name>string</month_name>
    </month>
    <year_name>string</year_name>
  </year>
</calendar>